{
  "created_at": "2026-04-17T12:00:00Z",
  "event_type": "standard",
  "filter": {
    "direction": "inbound",
    "keyword": "example_value",
    "user_id": "1234567890123456789"
  },
  "subscription_id": "1146654567674912769",
  "tag": "example_tag",
  "updated_at": "2026-04-17T12:00:00Z",
  "webhook_id": "1146654567674912769"
}